,Rank,Song Name,Artist,Duration,Album,Year,Lyrics
0,1,Wonderwall,Oasis,259,(What's the Story) Morning Glory?,1995-10-30,"[Verse 1]
Today is gonna be the day that they're gonna throw it back to you
By now, you should have somehow realised what you gotta do
I don't believe that anybody feels the way I do about you now

[Verse 2]
Backbeat, the word is on the street that the fire in your heart is out
I'm sure you've heard it all before, but you never really had a doubt
I don't believe that anybody feels the way I do about you now

[Pre-Chorus]
And all the roads we have to walk are winding
And all the lights that lead us there are blinding
There are many things that I would like to say to you
But I don't know how

[Chorus]
Because maybe
You're gonna be the one that saves me
And after all
You're my wonderwall

[Verse 3]
Today was gonna be the day, but they'll never throw it back to you
By now, you should've somehow realised what you're not to do
I don't believe that anybody feels the way I do about you now

[Pre-Chorus]
And all the roads that lead you there were winding
And all the lights that light the way are blinding
There are many things that I would like to say to you
But I don't know how

[Chorus]
I said maybe
You're gonna be the one that saves me
And after all
You're my wonderwall

I said maybe (I said maybe)
You're gonna be the one that saves me
And after all
You're my wonderwall

[Outro]
I said maybe (I said maybe)
You're gonna be the one that saves me (That saves me)
You're gonna be the one that saves me (That saves me)
You're gonna be the one that saves me

[Instrumental Outro]"
1,2,The Scientist,Coldplay,309,A Rush of Blood to the Head,2002-08-26,"[Verse 1]
Come up to meet you, tell you I'm sorry
You don't know how lovely you are
I had to find you, tell you I need you
Tell you I set you apart
Tell me your secrets, and ask me your questions
Oh, let's go back to the start
Running in circles, coming up tails
Heads on a science apart

[Chorus]
Nobody said it was easy
It's such a shame for us to part
Nobody said it was easy
No one ever said it would be this hard
Oh, take me back to the start

[Verse 2]
I was just guessing at numbers and figures
Pulling the puzzles apart
Questions of science, science and progress
Do not speak as loud as my heart
Tell me you love me, come back and haunt me
Oh, and I rush to the start
Running in circles, chasing our tails
Coming back as we are

[Chorus]
Nobody said it was easy
Oh it's such a shame for us to part
Nobody said it was easy
No one ever said it would be so hard
I'm going back to the start

[Outro]
Oh-ooh ooh-ooh-ooh-ooh
Aah-ooh ooh-ooh-ooh-ooh
Oh-ooh ooh-ooh-ooh-ooh
Oh-ooh ooh-ooh-ooh-ooh"
2,3,Yellow,Coldplay,267,Parachutes,2000-06-26,"[Verse 1: Chris Martin]
Look at the stars
Look how they shine for you
And everything you do
Yeah, they were all yellow
I came along
I wrote a song for you
And all the things you do
And it was called ""Yellow""
So then I took my turn
Oh, what a thing to have done
And it was all yellow

[Chorus 1: Chris, Jonny & Will]
(Aah) Your skin, oh yeah, your skin and bones
(Ooh) Turn into something beautiful
(Aah) You know, you know I love you so
You know I love you so

[Verse 2: Chris Martin]
I swam across
I jumped across for you
Oh, what a thing to do
'Cause you were all yellow
I drew a line
I drew a line for you
Oh, what a thing to do
And it was all yellow

[Chorus 2: Chris, Jonny & Will]
(Aah) Your skin, oh yeah, your skin and bones
(Ooh) Turn into something beautiful
(Aah) And you know
For you, I'd bleed myself dry
For you, I'd bleed myself dry

[Bridge: Chris Martin]
It's true, look how they shine for you
Look how they shine for you
Look how they shine for
Look how they shine for you
Look how they shine for you
Look how they shine

[Outro: Chris Martin]
Look at the stars
Look how they shine for you
And all the things that you do"
3,4,Fix You,Coldplay,294,X&Y,2005-06-06,"[Verse 1: Chris Martin]
When you try your best, but you don't succeed
When you get what you want, but not what you need
When you feel so tired, but you can't sleep
Stuck in reverse
And the tears come streaming down your face
When you lose something you can't replace
When you love someone, but it goes to waste
Could it be worse?

[Chorus: Chris & Will, Chris]
Lights will guide you home
And ignite your bones
And I will try to fix you

[Verse 2: Chris Martin]
And high up above or down below
When you're too in love to let it go
But if you never try, you'll never know
Just what you're worth

[Chorus: Chris & Will, Chris]
Lights will guide you home
And ignite your bones
And I will try to fix you

[Instrumental]

[Bridge: Chris, Jonny, Guy, Will]
Tears stream down your face
When you lose something you cannot replace
Tears stream down your face
And I

[Breakdown: Chris, Jonny, Guy, Will]
Tears stream down your face
I promise you I will learn from my mistakes
Tears stream down your face
And I

[Outro: Chris Martin]
Lights will guide you home
And ignite your bones
And I will try to fix you"
4,5,Chasing Cars,Snow Patrol,0,Eyes Open,2006-06-06,"[Verse 1]
We'll do it all
Everything
On our own
We don't need
Anything
Or anyone

[Chorus]
If I lay here
If I just lay here
Would you lie with me
And just forget the world?

[Verse 2]
I don't quite know
How to say
How I feel
Those three words
Are said too much
They're not enough

[Chorus]
If I lay here
If I just lay here
Would you lie with me
And just forget the world?
Forget what we're told
Before we get too old
Show me a garden
That's bursting into life

[Bridge]
Let's waste time
Chasing cars
Around our heads
I need your grace
To remind me
To find my own

[Chorus]
If I lay here
If I just lay here
Would you lie with me
And just forget the world?
Forget what we're told
Before we get too old
Show me a garden
That's bursting into life

[Chorus 2]
All that I am
All that I ever was
Is here in your perfect eyes
They're all I can see
I don't know where
Confused about how as well
Just know that these things
Will never change for us at all

[Chorus]
If I lay here
If I just lay here
Would you lie with me
And just forget the world?"
5,6,Iris,Goo Goo Dolls,289,Dizzy Up the Girl,1998-04-07,"[Verse 1]
And I'd give up forever to touch you
'Cause I know that you feel me somehow
You're the closest to heaven that I'll ever be
And I don't wanna go home right now

[Verse 2]
And all I can taste is this moment
And all I can breathe is your life
And sooner or later, it's over
I just don't wanna miss you tonight

[Chorus]
And I don't want the world to see me
'Cause I don't think that they'd understand
When everything's made to be broken
I just want you to know who I am

[Verse 3]
And you can't fight the tears that ain't coming
Or the moment of truth in your lies
When everything feels like the movies
Yeah, you bleed just to know you're alive

[Chorus]
And I don't want the world to see me
'Cause I don't think that they'd understand
When everything's made to be broken
I just want you to know who I am

[Instrumental]

[Chorus]
And I don't want the world to see me
'Cause I don't think that they'd understand
When everything's made to be broken
I just want you to know who I am

[Chorus]
And I don't want the world to see me
'Cause I don't think that they'd understand
When everything's made to be broken
I just want you to know who I am

[Outro]
I just want you to know who I am
I just want you to know who I am
I just want you to know who I am"
6,7,I'm Yours,Jason Mraz,242,I'm Yours,2008-04-15,"[Verse 1]
Well, you done done me, and you bet I felt it
I tried to be chill, but you're so hot that I melted
I fell right through the cracks
And now I'm trying to get back
Before the cool done run out
I'll be giving it my bestest
And nothing's gonna stop me but divine intervention
I reckon it's again my turn
To win some or learn some

[Chorus]
But I won't hesitate no more
No more it cannot wait, I'm yours
Hmm (Hey, hey)

[Verse 2]
Well, open up your mind and see like me
Open up your plans and, damn, you're free
And look into your heart, and you'll find love, love, love, love
Listen to the music of the moment, people dance and sing
We're just one big family
And it's our God-forsaken right to be loved, love, love, love, loved

[Chorus]
So I won't hesitate no more
No more it cannot wait, I'm sure

[Post-Chorus]
There's no need to complicate
Our time is short
This is our fate, I'm yours
A-do you, do, do, do you, but do you, do you, do, do, but do you want to come on?
Scooch on over closer, dear
And I will nibble your ear
A-soo da ba ba ba ba bum
Whoa, oh oh oh
Whoa, oh oh oh oh whoa whoa whoa
Uh-huh, hmm

[Verse 3]
I've been spending way too long checking my tongue in the mirror
And bending over backwards just to try to see it clearer
But my breath fogged up the glass
And so I drew a new face and I laughed
I guess what I've been saying is there ain't no better reason
To rid yourself of vanities and just go with the seasons
It's what we aim to do
Our name is our virtue

[Chorus]
But I won't hesitate no more
No more it cannot wait, I'm yours

[Verse 4]
Well, open up your mind and see like me (I won't hesitate)
Open up your plans and, damn, you're free (No more, no more)
And look into your heart, and you'll find that (It cannot wait)
The sky is yours (I'm sure there's no)
So please don't, please don't, please don't (No need, oh, now now)
There's no need to complicate (For the reggae, our time)
'Cause our time is short (Is short, this)
This oh, this oh, this is our fate (Is our fate)
I'm yours, ha!

[Outro]
Brr da ba mmm da ba bo mmm day
Na ch doo, doo ch doo, doo ch doo doo mmm doo doo
(Hey, hey) Oh, I'm yours, oh-oh, I'm yours
Oh-oh-oh-oh, whoa-oh-oh-oh
Baby, do you believe I'm yours?
You best believe, you best believe I'm yours, hmm"
7,8,I Will Follow You Into The Dark,Death Cab for Cutie,0,Plans,2006-06-26,"[Verse 1]
Love of mine, someday you will die
But I'll be close behind; I'll follow you into the dark
No blinding light or tunnels to gates of white
Just our hands clasped so tight, waiting for the hint of a spark

[Chorus]
If Heaven and Hell decide that they both are satisfied
Illuminate the ""No""s on their Vacancy signs
If there's no one beside you when your soul embarks
Then I'll follow you into the dark

[Verse 2]
In Catholic school, as vicious as Roman rule
I got my knuckles bruised by a lady in black
And I held my tongue as she told me, ""Son
Fear is the heart of love,"" so I never went back

[Chorus]
If Heaven and Hell decide that they both are satisfied
Illuminate the ""No""s on their Vacancy signs
If there's no one beside you when your soul embarks
Then I'll follow you into the dark

[Bridge]
You and me have seen everything to see
From Bangkok to Calgary and the soles of your shoes
Are all worn down; the time for sleep is now
It's nothing to cry about 'cause we'll hold each other soon
In the blackest of rooms

[Chorus]
And if Heaven and Hell decide that they both are satisfied
And illuminate the ""No""s on their Vacancy signs
If there's no one beside you when your soul embarks
Then I'll follow you into the dark

[Outro]
Then I'll follow you into the dark"
8,9,How to Save a Life,The Fray,290,How to Save a Life,2005-09-13,"[Verse 1]
Step one, you say we need to talk
He walks, you say ""sit down; it's just a talk""
He smiles politely back at you
You stare politely right on through
Some sort of window to your right
As he goes left and you stay right
Between the lines of fear and blame
You begin to wonder why you came

[Chorus]
Where did I go wrong? I lost a friend
Somewhere along in the bitterness
And I would have stayed up with you all night
Had I known how to save a life

[Verse 2]
Let him know that you know best
'Cause after all, you do know best
Try to slip past his defense
Without granting innocence
Lay down a list of what is wrong
The things you've told him all along
And pray to God He hears you
And pray to God He hears you, and

[Chorus]
Where did I go wrong? I lost a friend
Somewhere along in the bitterness
And I would have stayed up with you all night
Had I known how to save a life

[Verse 3]
As he begins to raise his voice
You lower yours and grant him one last choice
Drive until you lose the road
Or break with the ones you've followed
He will do one of two things
He will admit to everything
Or he'll say he's just not the same
And you'll begin to wonder why you came

[Chorus]
Where did I go wrong? I lost a friend
Somewhere along in the bitterness
And I would have stayed up with you all night
Had I known how to save a life

Where did I go wrong? I lost a friend
Somewhere along in the bitterness
And I would have stayed up with you all night
Had I known how to save a life

[Refrain]
How to save a life
How to save a life

[Chorus]
Where did I go wrong? I lost a friend
Somewhere along in the bitterness
And I would have stayed up with you all night
Had I known how to save a life

Where did I go wrong? I lost a friend
Somewhere along in the bitterness
And I would have stayed up with you all night
Had I known how to save a life

[Outro]
How to save a life
How to save a life"
9,10,Love Will Tear Us Apart,Joy Division,0,Die Kalten Winde Des Winters,1980-06-01,"[Verse 1]
When routine bites hard and ambitions are low
And resentment rides high, but emotions won't grow
And we're changing our ways, taking different roads

[Chorus]
Then love, love will tear us apart again
Love, love will tear us apart again

[Verse 2]
Why is the bedroom so cold? You've turned away on your side
Is my timing that flawed? Our respect runs so dry
Yet there's still this appeal that we've kept through our lives

[Chorus]
But love, love will tear us apart again
Love, love will tear us apart again

[Guitar Solo]

[Verse 3]
You cry out in your sleep, all my failings exposed
And there's a taste in my mouth as desperation takes hold
Just that something so good, just can't function no more

[Chorus]
Then love, love will tear us apart again
Love, love will tear us apart again
Then love, love will tear it apart again
Love, love will tear it apart again"
10,11,She Will Be Loved,Maroon 5,379,Songs About Jane,2002-06-25,"[Verse 1]
Beauty queen of only eighteen
She had some trouble with herself
He was always there to help her
She always belonged to someone else
I drove for miles and miles
And wound up at your door
I've had you so many times
But somehow, I want more

[Chorus]
I don't mind spending every day
Out on your corner in the pouring rain
Look for the girl with the broken smile
Ask her if she wants to stay a while
And she will be loved
And she will be loved

[Verse 2]
Tap on my window, knock on my door
I want to make you feel beautiful
I know I tend to get so insecure
Doesn't matter anymore
It's not always rainbows and butterflies
It's compromise that moves us along, yeah
My heart is full and my door's always open
You come any time you want, yeah

[Chorus]
I don't mind spending every day
Out on your corner in the pouring rain
Look for the girl with the broken smile
Ask her if she wants to stay a while
And she will be loved
And she will be loved
And she will be loved
And she will be loved

[Bridge]
I know where you hide
Alone in your car
Know all of the things that make you who you are
I know that goodbye means nothing at all
Comes back and makes me catch her every time she falls, yeah
Tap on my window, knock on my door
I want to make you feel beautiful

[Chorus]
I don't mind spending every day
Out on your corner in the pouring rain, oh
Look for the girl with the broken smile
Ask her if she wants to stay a while
And she will be loved
And she will be loved
And she will be loved
And she will be loved

[Outro fading out]
I don't mind spending every day
Out on your corner in the pouring rain
Please don't try so hard to say goodbye"
11,12,Such Great Heights,The Postal Service,262,Give Up,2003-01-01,"[Verse 1]
I am thinking it's a sign
That the freckles in our eyes
Are mirror images
And when we kiss they're perfectly aligned

And I have to speculate
That God himself did make
Us into corresponding shapes
Like puzzle pieces from the clay

[Verse 2]
And true, it may seem like a stretch
But it's thoughts like this that catch
My troubled head when you're away
When I am missing you to death

When you are out there on the road
For several weeks of shows
And when you scan the radio
I hope this song will guide you home

[Chorus]
They will see us waving from such great heights
""Come down now,"" they'll say
But everything looks perfect from far away
""Come down now,"" but we'll stay

[Verse 3]
I tried my best to leave
This all on your machine
But the persistent beat
It sounded thin upon listening

And that frankly will not fly
You will hear the shrillest highs
And lowest lows with the windows down
When this is guiding you home

[Chorus]
They will see us waving from such great heights
""Come down now,"" they'll say
But everything looks perfect from far away
""Come down now,"" but we'll stay

They will see us waving from such great heights
""Come down now,"" they'll say
But everything looks perfect from far away
""Come down now,"" but we'll stay

[Outro]
(They will see us waving from such great heights)
(Come down now)
They will see us waving from such great heights
(Come down now)"
12,13,Skinny Love,Bon Iver,239,"For Emma, Forever Ago",2007-07-08,"[Verse 1]
Come on, skinny love, just last the year
Pour a little salt, we were never here
My, my, my, my, my, my, my, my
Staring at the sink of blood and crushed veneer
I tell my love to wreck it all
Cut out all the ropes and let me fall
My, my, my, my, my, my, my, my
Right in this moment, this order's tall

[Chorus]
And I told you to be patient
And I told you to be fine
And I told you to be balanced
And I told you to be kind
And in the morning I'll be with you
But it will be a different kind
And I'll be holding all the tickets
And you'll be owning all the fines

[Verse 2]
Come on, skinny love, what happened here?
Suckle on the hope in light brassieres
My, my, my, my, my, my, my, my
Sullen load is full, so slow on the split

[Chorus]
And I told you to be patient
And I told you to be fine
And I told you to be balanced
And I told you to be kind
And now all your love is wasted
And then who the hell was I?
And I'm breaking at the britches
And at the end of all your lines

[Verse 3]
Who will love you?
Who will fight?
Who will fall far behind?"
13,14,Fake Plastic Trees,Radiohead,285,The Bends,1995-05-15,"[Verse 1]
A green plastic watering can
For a fake Chinese rubber plant
In a fake plastic earth
That she bought from a rubber man
In a town full of rubber plans
To get rid of itself

[Chorus 1]
It wears her out
It wears her out
It wears her out
It wears her out

[Verse 2]
She lives with a broken man
A cracked polystyrene man
Who just crumbles and burns
He used to do surgery
For girls in the 80s
But gravity always wins

[Chorus 2]
And it wears him out
It wears him out
It wears him out
It wears

[Verse 3]
She looks like the real thing
She tastes like the real thing
My fake plastic love
But I can't help the feeling
I could blow through the ceiling
If I just turn and run

[Chorus 3]
And it wears me out
It wears me out
It wears me out
It wears me out

[Outro]
And if I could be who you wanted
If I could be who you wanted
All the time
All the time"
14,15,Friday I'm in Love,The Cure,214,Greatest Hits,1992-05-11,"[Verse 1]
I don't care if Monday's blue
Tuesday's grey and Wednesday too
Thursday I don't care about you
It's Friday, I'm in love
Monday you can fall apart
Tuesday, Wednesday, break my heart
Oh, Thursday doesn't even start
It's Friday, I'm in love

[Chorus]
Saturday, wait
And Sunday always comes too late
But Friday, never hesitate

[Verse 2]
I don't care if Monday's black
Tuesday, Wednesday heart attack
Thursday never looking back
It's Friday, I'm in love

[Verse 3]
Monday you can hold your head
Tuesday, Wednesday stay in bed
Or Thursday watch the walls instead
It's Friday, I'm in love

[Chorus]
Saturday, wait
And Sunday always comes too late
But Friday, never hesitate

[Bridge]
Dressed up to the eyes
It's a wonderful surprise
To see your shoes and your spirits rise
Throwing out your frown
And just smiling at the sound
And as sleek as a shriek
Spinning round and round
Always take a big bite
It's such a gorgeous sight
To see you eat in the middle of the night
You can never get enough
Enough of this stuff
It's Friday I'm in love

[Verse 4]
I don't care if Monday's blue
Tuesday's grey and Wednesday too
Thursday I don't care about you
It's Friday, I'm in love
Monday you can fall apart
Tuesday, Wednesday break my heart
Thursday doesn't even start
It's Friday, I'm in love"
15,16,Somewhere Only We Know,Keane,234,Hopes and Fears,2004-02-16,"[Verse 1]
I walked across an empty land
I knew the pathway like the back of my hand
I felt the earth beneath my feet
Sat by the river, and it made me complete

[Pre-Chorus]
Oh, simple thing, where have you gone?
I'm getting old and I need something to rely on
So tell me when you're gonna let me in
I'm getting tired and I need somewhere to begin

[Verse 2]
I came across a fallen tree
I felt the branches of it looking at me
Is this the place we used to love?
Is this the place that I've been dreaming of?

[Pre-Chorus]
Oh, simple thing, where have you gone?
I'm getting old and I need something to rely on
So tell me when you're gonna let me in
I'm getting tired and I need somewhere to begin

[Chorus]
And if you have a minute, why don't we go
Talk about it somewhere only we know?
This could be the end of everything
So why don't we go
Somewhere only we know?
Somewhere only we know?

[Pre-Chorus]
Oh, simple thing, where have you gone?
I'm getting old and I need something to rely on
So tell me when you're gonna let me in
I'm getting tired and I need somewhere to begin

[Chorus]
And if you have a minute, why don't we go
Talk about it somewhere only we know?
This could be the end of everything
So why don't we go?
So why don't we go?
Ooh, aah

[Outro]
This could be the end of everything
So why don't we go
Somewhere only we know?
Somewhere only we know
Somewhere only we know"
16,17,This Love,Maroon 5,0,Songs About Jane,2002-06-25,"[Verse 1]
I was so high I did not recognize
The fire burning in her eyes
The chaos that controlled my mind
Whispered goodbye as she got on a plane
Never to return again
But always in my heart

[Chorus]
This love has taken its toll on me
She said goodbye too many times before
And her heart is breaking in front of me
And I have no choice, 'cause I won't say goodbye anymore

[Verse 2]
I tried my best to feed her appetite
Keep her coming every night
So hard to keep her satisfied
Keep playing love like it was just a game
Pretending to feel the same
Then turn around and leave again

[Chorus]
This love has taken its toll on me
She said goodbye too many times before
And her heart is breaking in front of me
And I have no choice, 'cause I won't say goodbye anymore

[Bridge]
I'll fix these broken things
Repair your broken wings
And make sure everything's alright (It's alright, it's alright)
My pressure on your hips
Sinking my fingertips
Into every inch of you
'Cause I know that's what you want me to do

[Chorus]
This love has taken its toll on me
She said goodbye too many times before
And her heart is breaking in front of me
And I have no choice, 'cause I won't say goodbye anymore
This love has taken its toll on me
She said goodbye too many times before
And my heart is breaking in front of me
She said goodbye too many times before
This love has taken its toll on me
She said goodbye too many times before
And her heart is breaking in front of me
I have no choice, 'cause I won't say goodbye anymore"
