,Rank,Song Name,Artist,Duration,Album,Year,Lyrics
89,90,Where Is the Love,Black Eyed Peas,515,Elephunk,2003-06-16,"[Verse 1: will.i.am]
What's wrong with the world, mama?
People livin' like they ain't got no mamas
I think the whole world's addicted to the drama
Only attracted to the things that'll bring you trauma
Overseas, yeah, we tryin' to stop terrorism
But we still got terrorists here livin'
In the USA, the big CIA
The Bloods and the Crips, and the KKK
But if you only have love for your own race
Then you only leave space to discriminate
And to discriminate only generates hate
And when you hate, then you're bound to get irate
Madness is what you demonstrate
And that's exactly how anger works and operates
Man, you gotta have love, this'll set us straight
Take control of your mind and meditate
Let your soul gravitate to the love, y'all, y'all

[Chorus]
People killin', people dyin'
Children hurt and you hear them cryin'
Can you practice what you preach?
And would you turn the other cheek?
Father, father, father, help us
Send some guidance from above
These people got me, got me questionin'
Where is the love? (love)
Where is the love? (the love)
Where is the love? (the love)
Where is the love? (the love, the love)

[Verse 2: Taboo]
It just ain't the same, old ways have changed
New days are strange, is the world insane?
If love and peace is so strong
Then why are there pieces of love that don't belong
Nations droppin' bombs
Chemical gases fillin' lungs of little ones
With ongoing sufferin' as the youth die young
So ask yourself, is the lovin' really gone?
So I can ask myself, really, what is going wrong?
With this world that we livin' in, people keep on givin' in
Makin' wrong decisions, only visions of them dividends
Not respectin' each other, deny thy brother
A war is goin' on, but the reason's undercover
The truth is kept secret, and swept under the rug
If you never know truth, then you never know love
Where's the love, y'all? (Come on, I don't know)
Where's the truth, y'all? (Come on, I don't know)
And where's the love y'all?

[Chorus]
People killin', people dyin'
Children hurt and you hear them cryin'
Will you practice what you preach?
And would you turn the other cheek?
Father, father, father, help us
Send some guidance from above
These people got me, got me questionin'
Where is the love? (love)
Where is the love? (the love)
Where is the love? (the love)
Where is the love? (the love, the love)

[Verse 3: apl.de.ap]
I feel the weight of the world on my shoulder
As I'm getting older, y'all people gets colder
Most of us only care about money-makin'
Selfishness got us followin' the wrong direction
Wrong information always shown by the media
Negative images is the main criteria
Infecting the young minds faster than bacteria
Kids wanna act like what they see in the cinema
Yo, whatever happened to the values of humanity?
Whatever happened to the fairness and equality?
Instead of spreadin' love we spreadin' animosity
Lack of understandin' leading us away from unity
That's the reason why sometimes I'm feelin' under
That's the reason why sometimes I'm feelin' down
It's no wonder why sometimes I'm feelin' under
Gotta keep my faith alive 'til love is found
Now ask yourself…

[Bridge: will.i.am]
Where is the love?
Where is the love?
Where is the love?
Where is the love?
Father, father, father, help us
Send some guidance from above
These people got me, got me questionin'
Where is the love?

[Outro]
Now sing with me, y'all (one world, one world)
We only got (one world, one world)
That's all we got (one world, one world)
And something's wrong with it
Something's wrong with it
Something's wrong with the w-w-world
We only got (one world, one world)
That's all we got (one world, one world)"
90,91,Thinkin Bout You,Frank Ocean,203,channel ORANGE,2012-04-17,"[Verse 1]
A tornado flew around my room before you came
Excuse the mess it made, it usually doesn't rain in
Southern California, much like Arizona
My eyes don't shed tears, but boy, they pour when

[Pre-Chorus]
I'm thinkin' 'bout you, ooh no, no, no
I've been thinkin' bout you, you know, know, know
I've been thinkin' bout you, do you think about me still?
Do ya, do ya?

[Chorus]
Or do you not think so far ahead?
'Cause I been thinkin' bout forever, ooh
Or do you not think so far ahead?
'Cause I been thinkin' bout forever, ooh

[Verse 2]
No, I don't like you, I just thought you were cool enough to kick it
Got a beach house I could sell you in Idaho
Since you think I don't love you, I just thought you were cute
That's why I kissed you
Got a fighter jet, I don't get to fly it though, I'm lying down

[Pre-Chorus]
Thinkin' 'bout you, ooh no, no, no
I've been thinkin' bout you, you know, know, know
I've been thinkin' bout you, do you think about me still?
Do ya, do ya?

[Chorus]
Or do you not think so far ahead?
'Cause I been thinkin' bout forever, ooh
Or do you not think so far ahead?
'Cause I been thinkin' bout forever, ooh

[Bridge]
Yes, of course, I remember, how could I forget (How could I forget?) how you feel? (How you feel)
You know you were my first time, a new feel
It won't ever get old, not in my soul, not in my spirit, keep it alive
We'll go down this road 'til it turns from color to black and white

[Chorus]
Or do you not think so far ahead?
'Cause I been thinkin' bout forever, ooh
Or do you not think so far ahead?
'Cause I been thinkin' bout forever, ooh"
91,92,Bubbly,Colbie Caillat,198,Coco,2007-07-10,"[Intro]
Will you count me in?

[Verse 1]
I've been awake for a while now
You've got me feeling like a child now
'Cause every time I see your bubbly face
I get the tingles in a silly place

[Chorus]
It starts in my toes and I crinkle my nose
Wherever it goes, I always know
That you make me smile, please stay for a while now
Just take your time, wherever you go

[Verse 2]
The rain is falling on my window pane
But we are hiding in a safer place
Under covers, staying dry and warm
You give me feelings that I adore

[Chorus]
They start in my toes, make me crinkle my nose
Wherever it goes, I always know
That you make me smile, please stay for a while now
Just take your time, wherever you go

[Bridge]
But what am I gonna say
When you make me feel this way?
I just... Mmm

[Chorus]
And it starts in my toes, makes me crinkle my nose
Wherever it goes, I always know
That you make me smile, please stay for a while now
Just take your time, wherever you go
Ta-da-dam, ta-da, da-dam, ta-da-dam, ta-da-da-da, ta-da-dam
Um-ba, da-da, um-ba, ta-da-da-da, uhm

[Breakdown]
I've been asleep for a while now
You tuck me in, just like a child now
'Cause every time you hold me in your arms
I'm comfortable enough to feel your warmth

[Chorus]
It starts in my soul and I lose all control
When you kiss my nose, the feeling shows
'Cause you make me smile, baby, just take your time now
Holding me tight

[Outro]
Wherever, wherever, wherever you go
Wherever, wherever, wherever you go
Wherever you go, I always know
'Cause you make me smile, even just for a while"
92,93,Breakeven,The Script,261,The Script,2008-08-08,"[Intro]
I'm still alive but I'm barely breathing
Just praying to a God that I don't believe in
'Cause I got time while she got freedom
'Cause when a heart breaks no it don't break even

[Verse 1]
Her best days will be some of my worst
She finally met a man that's gonna put her first
While I'm wide awake she's no trouble sleeping
'Cause when a heart breaks no it don't breakeven
Even... no

[Chorus]
What am I supposed to do when the best part of me was always you?
And what am I supposed to say when I'm all choked up and you're ok?
I'm falling to pieces, yeah
I'm falling to pieces

[Verse 2]
They say bad things happen for a reason
But no wise words gonna stop the bleeding
'Cause she's moved on while I'm still grieving
And when a heart breaks no it don't breakeven even, even
... no

[Chorus]
What am I gonna do when the best part of me was always you?
And what am I supposed to say when I'm all choked up and you're ok?
I'm falling to pieces, yeah
I'm falling to pieces, yeah
I'm falling to pieces
(One still in love while the other one's leaving)
I'm falling to pieces
('Cause when a heart breaks no it don't break even)

[Bridge]
Oh, you got his heart and my heart and none of the pain
You took your suitcase, I took the blame
Now I'm tryna make sense of what little remains, oh
'Cause you left me with no love and no love to my name

[Verse 3]
I'm still alive but I'm barely breathing
Just prayed to a God that I don't believe in
'Cause I got time while she got freedom
'Cause when a heart breaks no it don't break
No it don't break no it don't break even no

[Chorus]
What am I gonna do when the best part of me was always you?
And what am I supposed to say when I'm all choked up that you're ok?
I'm falling to pieces, yeah
I'm falling to pieces, yeah
I'm falling to pieces
(One still in love while the other one's leaving)
I'm falling to pieces
('Cause when a heart breaks no it don't break even)

[Outro]
Oh, it don't break even, no
Oh, it don't break even, no
Oh, it don't break even, no"
93,94,Pictures of You,The Cure,476,Disintegration,1989-05-02,"[Instrumental Intro]

[Verse 1]
I've been looking so long at these pictures of you
That I almost believe that they're real
I've been living so long with my pictures of you
That I almost believe, that the pictures are all I can feel

[Verse 2]
Remembering you
Standing quiet in the rain
As I ran to your heart to be near
And we kissed as the sky fell in
Holding you close
How I always held close in your fear
Remembering you
Running soft through the night
You were bigger and brighter and wider than snow
And screamed at the make-believe
Screamed at the sky
And you finally found all your courage
To let it all go

[Verse 3]
Remembering you
Fallen into my arms
Crying for the death of your heart
You were stone white
So delicate
Lost in the cold
You were always so lost in the dark
Remembering you
How you used to be
Slow drowned
You were angels
So much more than everything
Hold for the last time then slip away quietly
Open my eyes
But I never see anything

[Bridge]
If only I'd thought of the right words
I could have held on to your heart
If only I'd thought of the right words
I wouldn't be breaking apart
All my pictures of you

[Verse 4]
Looking so long at these pictures of you
But I never hold on to your heart
Looking so long for the words to be true
But always just breaking apart
My pictures of you

[Outro]
There was nothing in the world
That I ever wanted more
Than to feel you deep in my heart
There was nothing in the world
That I ever wanted more
Than to never feel the breaking apart
All my pictures of you"
94,95,A Message,Coldplay,285,X&Y,2005-06-06,"[Verse 1]
My song is love
Love to the loveless shown
And it goes on
You don't have to be alone

[Verse 2]
Your heavy heart
Is made of stone
And it's so hard to see you, clearly
You don't have to be on your own
You don't have to be on your own

[Hook]
And I'm not gonna take it back
And I'm not gonna say I don't mean that
You're the target that I'm aiming at
Can I get that message home?

[Verse 3]
My song is love
My song is love unknown
But I'm on fire for you, clearly
You don't have to be alone
You don't have to be on your own

[Hook]
And I'm not gonna take it back
And I'm not gonna say I don't mean that
You're the target that I'm aiming at
And I'm nothing on my own
Got to get that message home

[Bridge]
And I'm not gonna stand and wait
I'm not gonna leave it until it's much too late
On a platform, I'm gonna stand and say
That I'm nothing on my own
And I love you, please come home

[Outro]
My song is love, is love unknown
And I've got to get that message home"
95,96,My Girl,The Temptations,177,The Ultimate Collection,1964-12-21,"[Instrumental Intro]

[Verse 1]
I've got sunshine on a cloudy day
When it's cold outside, I've got the month of May
I guess you'd say
What can make me feel this way?

[Chorus]
My girl, my girl, my girl
Talkin' 'bout my girl, my girl

[Verse 2]
I've got so much honey, the bees envy me
I've got a sweeter song than the birds in the trees
Well, I guess you'd say
What can make me feel this way?

[Chorus]
My girl, my girl, my girl
Talkin' 'bout my girl, my girl

[Bridge]
Ooh, ooh
Hey, hey, hey
Ooh, ooh
Hey, hey, hey
Ooh, ooh, yeah

[Verse 3]
I don't need no money, fortune, or fame
I've got all the riches, baby, one man can claim
Well, I guess you'd say
What can make me feel this way?

[Chorus]
My girl, my girl, my girl
Talkin' 'bout my girl, my girl
(Talkin' 'bout my girl)

[Outro]
I've got sunshine on a cloudy day (Woah, woah)
With my girl
I've even got the month of May
With my girl
Talkin' 'bout my girl"
96,97,Thank You,Dido,218,Greatest Hits,2000-12-12,"[Verse 1]
My tea's gone cold, I'm wondering why
I got out of bed at all
The morning rain clouds up my window
And I can't see at all
And even if I could, it'd all be grey
But your picture on my wall
It reminds me that it's not so bad
It's not so bad

[Verse 2]
I drank too much last night, got bills to pay
My head just feels in pain
I missed the bus and there'll be hell today
I'm late for work again
And even if I'm there, they'll all imply
That I might not last the day
And then you call me
And it's not so bad, it's not so bad

[Chorus]
And I want to thank you
For giving me the best day of my life
Oh, just to be with you
Is having the best day of my life

[Verse 3]
Push the door, I'm home at last
And I'm soaking through and through
Then you handed me a towel
And all I see is you
And even if my house falls down now
I wouldn't have a clue
Because you're near me

[Chorus]
And I want to thank you
For giving me the best day of my life
Oh, just to be with you
Is having the best day of my life
And I want to thank you
For giving me the best day of my life
Oh, just to be with you
Is having the best day of my life"
97,98,Let Me Love You,Mario,256,Turning Point,2004-11-16,"[Intro]
Mmmm, ah
Mmmm, yeah
Mmmm
Yeah, yeah, yeah
Mmmm, ah
Mmmm, yeah
Mmmm
Yeah, yeah

[Verse 1]
Baby, I just don't get it, do you enjoy being hurt?
I know you smelled the perfume, the make-up on his shirt
You don't believe his stories, you know that they're all lies
Bad as you are, you stick around and I just don't know why

[Pre-Chorus]
If I was ya' man, baby, you'd...
Never worry 'bout what I do
I'd be coming home, back to you, every night, doing you right
You're the type of woman who deserves good things
Fistful of diamonds, a hand full of rings
Baby, you're a star, I just wanna show you you are

[Chorus]
You should let me love you
Let me be the one to
Give you everything you want and need
Baby, good love and protection
Make me your selection
Show you the way love's supposed to be
Baby, you should let me love you, love you, love you
Love you
Yeah, listen

[Verse 2]
Your true beauty’s description; looks so good that it hurts
You're a dime, plus 99, and it's a shame
Don't even know what you're worth
Everywhere you go, they stop and stare, 'cause you're bad and it shows
From your head to your toes, out of control
Baby, you know

[Pre-Chorus]
If I was ya' man, baby, you'd...
Never worry 'bout what I do
I'd be coming home, back to you, every night, doing you right
You're the type of woman who deserves good things
Fistful of diamonds, a hand full of rings
Baby, you're a star, I just wanna show you you are

[Chorus]
You should let me love you
Let me be the one to
Give you everything you want and need
Ooh baby, good love and protection
Make me your selection
Show you the way love's supposed to be
Baby, you should let me

[Bridge]
You deserve better, girl (Oh, you know you deserve better)
We should be together, girl (Baby)
With me and you, it's whatever girl, hey
So can we make this thing ours?

[Chorus]
You should let me love you
Let me be the one to (Let me be the one to give)
Give you everything you want and need (Everything you need)
Baby, good love and protection (Said everything)
Make me your selection (Will you take me, baby?)
Show you the way love's supposed to be (Oh)
Baby, you should let me love you
Let me be the one to
Give you everything you want and need (Give you everything)
That good love and protection
Make me your selection
Show you the way love's supposed to be (Hey)
You should let me love you (Love you)
Let me be the one to give you everything you want and need
(The one to, everything you need)
Good love and protection (Protection)
Make me your selection (Selection, baby)
Show you the way love's supposed to be, yeah (Oh)
Let me love you
That's all you need, baby"
98,99,In the Aeroplane Over the Sea,Neutral Milk Hotel,216,In the Aeroplane Over the Sea,1998-02-10,"[Verse 1]
What a beautiful face
I have found in this place
That is circling all round the sun
What a beautiful dream
That could flash on the screen
In a blink of an eye and be gone from me

[Chorus 1]
Soft and sweet
Let me hold it close and keep it here with me

[Verse 2]
And one day we will die
And our ashes will fly
From the aeroplane over the sea
But for now we are young
Let us lay in the sun
And count every beautiful thing we can see

[Chorus 2]
Love to be
In the arms of all I'm keeping here with me

[Verse 3]
What a curious life
We have found here tonight
There is music that sounds from the street
There are lights in the clouds
Anna's ghost all around
Hear her voice as it's rolling and ringing through me

[Chorus 3]
Soft and sweet
How the notes all bend and reach above the trees

[Bridge]
Now how I remember you
How I would push my fingers through
Your mouth to make those muscles move
That made your voice so smooth and sweet
But now we keep where we don't know
All secrets sleep in winter clothes
With the one you loved so long ago
Now he don't even know his name

[Verse 4]
What a beautiful face
I have found in this place
That is circling all 'round the sun
And when we meet on a cloud
I'll be laughing out loud
I'll be laughing with everyone I see

[Chorus 4]
Can't believe
How strange it is to be anything at all"
99,100,Stand By Me,Ben E. King,179,Stand by Me,1961-06-17,"[Intro]

[Verse 1]
When the night has come
And the land is dark
And the moon is the only light we'll see
No I won't be afraid
Oh, I won't be afraid
Just as long as you stand, stand by me

[Chorus]
So darlin', darlin', stand by me
Oh, stand by me
Oh, stand
Stand by me, stand by me

[Verse 2]
If the sky that we look upon
Should tumble and fall
Or the mountains should crumble to the sea
I won't cry, I won't cry
No I won't shed a tear
Just as long as you stand, stand by me

[Chorus]
And darlin', darlin', stand by me
Oh, stand by me
Woah, stand now
Stand by me, stand by me

[Interlude]

[Chorus]
And darlin', darlin', stand by me
Oh, stand by me
Woah, stand now
Stand by me, stand by me
Whenever you're in trouble won't you stand by me
Oh, stand by me
Woah, just stand now
Oh, stand, stand by me"
100,101,Apologize,OneRepublic,354,Dreaming Out Loud,2006-04-30,"[Verse 1]
I'm holding on your rope, got me ten feet off the ground
And I'm hearing what you say, but I just can't make a sound
You tell me that you need me, then you go and cut me down
But wait
You tell me that you're sorry, didn't think I'd turn around
And say (That)

[Chorus]
It's too late to apologize, it's too late
I said it's too late to apologize, it's too late
Too late, oh, oh

[Verse 2]
I'd take another chance, take a fall, take a shot for you, oh, oh
I need you like a heart needs a beat, but it's nothing new
Yeah, yeah
I loved you with a fire red, now it's turning blue
And you say
Sorry like the angel Heaven let me think was you
But I'm afraid

[Chorus]
It's too late to apologize, it's too late
I said it's too late to apologize
It's too late, oh, oh
It's too late to apologize, it's too late
I said it's too late to apologize, it's too late
I said it's too late to apologize, yeah
I said it's too late to apologize, yeah

[Outro]
I'm holding on your rope, got me ten feet off the ground"
101,102,Far Away,Nickelback,0,All The Right Reasons,,
102,103,Lying Is the Most Fun a Girl Can Have Without Taking Her Clothes Off,Panic! at the Disco,200,A Fever You Can't Sweat Out,,
103,104,Such Great Heights,Iron & Wine,256,,,
104,105,A Rush of Blood to the Head,Coldplay,416,A Rush of Blood to the Head,,
105,106,Apologize,Timbaland,185,Apologize,,
106,107,Nothing Better,The Postal Service,226,Give Up,,
107,108,Your Body Is a Wonderland,John Mayer,249,Room for Squares,,
108,109,Wonderful Tonight,Eric Clapton,0,The Cream of Clapton,,
109,110,Goodbye My Lover,James Blunt,256,Back to Bedlam,,
110,111,Love The Way You Lie,Eminem,0,Recovery,,
111,112,Falling Away With You,Muse,280,Absolution,,
112,113,Marching Bands of Manhattan,Death Cab for Cutie,252,Plans,,
113,114,Re: Stacks,Bon Iver,401,"For Emma, Forever Ago",,
114,115,You Found Me,The Fray,242,The Fray,,
115,116,The Man Who Can't Be Moved,The Script,240,The Script,,
116,117,The Only Exception,Paramore,267,Brand New Eyes,,
117,118,Crown of Love,Arcade Fire,0,Funeral,,
118,119,Replay,Iyaz,182,Replay,,
119,120,To Be Alone With You,Sufjan Stevens,165,Seven Swans,,
120,121,If I Ever Feel Better,Phoenix,268,United,,
121,122,With You,Chris Brown,252,Exclusive,,
122,123,Forever,Chris Brown,277,Exclusive: The Forever Edition,,
123,124,She Loves You,The Beatles,136,1,,
124,125,Young and Beautiful,Lana Del Rey,235,The Dome: Summer 2013,,
125,126,Meet Me Halfway,Black Eyed Peas,0,The E.N.D. (The Energy Never Dies),,
126,127,A Thousand Miles,Vanessa Carlton,235,Be Not Nobody,,
127,128,Swallowed in the Sea,Coldplay,238,X&Y,,
128,129,Stop Crying Your Heart Out,Oasis,303,Heathen Chemistry,,
129,130,A Lack of Color,Death Cab for Cutie,216,Transatlanticism,,
130,131,Eight Days a Week,The Beatles,165,Beatles for Sale,,
131,132,Your Heart Is an Empty Room,Death Cab for Cutie,219,Plans,,
132,133,Is This Love,Bob Marley & The Wailers,233,,,
133,134,God Only Knows,The Beach Boys,169,Summer Dreams,,
134,135,Off to the Races,Lana Del Rey,300,Born to Die - The Paradise Edition,,
135,136,Jar of Hearts,Christina Perri,247,Jar of Hearts,,
136,137,9 Crimes,Damien Rice,219,9,,
137,138,Nothing Compares 2 U,Sinéad O'Connor,280,I Do Not Want What I Haven't Got,,
138,139,Wish You Were Here,Incubus,247,Monuments And Melodies,,
139,140,Blood Bank,Bon Iver,284,Blood Bank,,
140,141,The Blower's Daughter,Damien Rice,284,O,,
141,142,No One's Gonna Love You,Band of Horses,235,Acoustic At The Ryman,,
142,143,Ocean Avenue,Yellowcard,0,Ocean Avenue,,
143,144,Always,blink-182,251,blink-182,,
144,145,"Flightless Bird, American Mouth",Iron & Wine,243,,,
145,146,Bridge over Troubled Water,Simon & Garfunkel,0,,,
146,147,I Will Always Love You,Whitney Houston,274,The Bodyguard,,
147,148,Take a Bow,Rihanna,228,Take a Bow,,
148,149,You Belong with Me,Taylor Swift,231,Fearless,,
149,150,Need You Now,Lady Antebellum,235,Need You Now,,
150,151,Thinking Out Loud,Ed Sheeran,280,x,,
151,152,In My Life,The Beatles,147,Rubber Soul,,
152,153,Transatlanticism,Death Cab for Cutie,475,Transatlanticism,,
153,154,Kiss from a Rose,Seal,309,Seal II,,
154,155,Endlessly,Muse,228,Absolution,,
155,156,The Ghost of You,My Chemical Romance,0,Three Cheers for Sweet Revenge,,
156,157,My Love,Justin Timberlake,278,Greatest Hits,,
157,158,Clark Gable,The Postal Service,296,Give Up,,
158,159,You Could Be Happy,Snow Patrol,182,Eyes Open,,
159,160,Here with Me,Dido,255,No Angel,,
160,161,Someday You Will Be Loved,Death Cab for Cutie,193,Plans,,
161,162,Everything Will Be Alright,The Killers,345,Hot Fuss,,
162,163,Brand New Colony,The Postal Service,252,Give Up,,
163,164,Careless Whisper,George Michael,304,Ladies & Gentlemen: The Best of George Michael,,
164,165,Knock You Down,Keri Hilson,327,Knock You Down,,
165,166,Skinny Love,Birdy,201,Birdy,,
166,167,Lips Of An Angel,Hinder,261,Extreme Behavior,,
167,168,Romeo and Juliet,Dire Straits,354,Making Movies,,
168,169,You Give Me Something,James Morrison,212,Undiscovered,,
169,170,What Sarah Said,Death Cab for Cutie,380,Plans,,
170,171,I Don't Love You,My Chemical Romance,237,The Black Parade,,
171,172,All of Me,John Legend,0,Love in the Future,,
172,173,Creature Fear,Bon Iver,186,"For Emma, Forever Ago",,
173,174,Do You Realize??,The Flaming Lips,213,Yoshimi Battles The Pink Robots,,
174,175,Dilemma,Nelly,289,6 Derrty Hits,,
175,176,Radio,Lana Del Rey,215,Born to Die - The Paradise Edition,,
176,177,We Will Become Silhouettes,The Postal Service,0,Give Up,,
177,178,Don't You Remember,Adele,244,21,,
178,179,Brothers on a Hotel Bed,Death Cab for Cutie,0,Plans,,
179,180,Fields of Gold,Sting,226,Ten Summoner's Tales,,
180,181,Dakota,Stereophonics,297,Language. Sex. Violence. Other?,,
181,182,When You're Gone,Avril Lavigne,0,The Softer Side,,
182,183,Slow Dancing in a Burning Room,John Mayer,241,Continuum,,
183,184,I'm Gonna Be (500 Miles),The Proclaimers,219,Finest,,
184,185,Fade Into You,Mazzy Star,291,So Tonight That I Might See,,
185,186,Unintended,Muse,237,Showbiz,,
186,187,Love Hurts,Incubus,237,Light Grenades,,
187,188,Set the Fire to the Third Bar,Snow Patrol,239,Up to Now,,
188,189,Pale Blue Eyes,The Velvet Underground,383,The Velvet Underground,,
189,190,If I Ain't Got You,Alicia Keys,232,The Diary of Alicia Keys,,
190,191,Jóga,Björk,326,Homogenic,,
191,192,But It's Better If You Do,Panic! at the Disco,183,A Fever You Can't Sweat Out,,
192,193,Wicked Game,Chris Isaak,284,Wicked Game,,
193,194,Delicate,Damien Rice,311,O,,
194,195,Angels,Robbie Williams,239,Greatest Hits,,
195,196,The One That Got Away,Katy Perry,227,Teenage Dream,,
196,197,All the Right Moves,OneRepublic,237,Waking Up,,
197,198,Can't Help Falling in Love,Elvis Presley,178,Elvis 75,,
198,199,You and Me,Lifehouse,195,Lifehouse,,
199,200,You're All I Have,Snow Patrol,272,Eyes Open,,
200,201,I'm with You,Avril Lavigne,0,Let Go,,
201,202,5 Years Time,Noah and the Whale,0,"Peaceful, The World Lays Me Down",,
202,203,Do You Remember,Jack Johnson,249,In Between Dreams,,
203,204,One and Only,Adele,348,21,,
204,205,Still Loving You,Scorpions,385,Love at First Sting,,
205,206,Rehab,Rihanna,294,Good Girl Gone Bad,,
